{
  "context": {
    "schema_version": "1.0.0",
    "request_id": "req_feishu_00000003",
    "correlation_id": "corr_feishu_00000003",
    "trace_id": "trace_feishu_00000003",
    "requested_at": "2026-08-06T10:20:00Z",
    "actor": {
      "tenant_id": "tenant_yaya",
      "actor_id": "feishu_teacher_001",
      "actor_type": "teacher",
      "roles": [
        "teacher",
        "learner:read"
      ]
    },
    "content_ref": {
      "unit_id": "YAYA_FARM_001",
      "version": "1.3.2",
      "content_hash": "cccccccccccccccccccccccccccccccccccccccccccccccccccccccccccccccc"
    }
  },
  "learner_ref": "lrn_00000001",
  "purpose": "TEACHER_SUPPORT",
  "requested_fields": [
    "MASTERY_SUMMARY",
    "RECENT_EVIDENCE",
    "SUPPORT_NEEDS",
    "DATA_FRESHNESS"
  ],
  "consent_basis": "EDUCATIONAL_SERVICE",
  "time_range": {
    "from": "2026-07-30T00:00:00Z",
    "to": "2026-08-06T10:20:00Z"
  }
}
